{
  "$schema": "../../schemas/diagnostic_event.schema.json",
  "schema_version": "1.0.0",
  "event_id": "missing_asset",
  "severity": "error",
  "message": "Part asset not found: assets/text_intro.md",
  "hint": "Verify the asset path in the part manifest and ensure the file ships with the content pack.",
  "scope": {
    "module_id": "physics",
    "section_id": "motion",
    "package_id": "page_001",
    "part_id": "text_intro"
  },
  "details": {
    "expected_path": "assets/text_intro.md",
    "checked_at": "load"
  },
  "timestamp": "2025-01-01T00:00:00Z"
}
